{
  "$schema": "https://json-schema.org/draft/2020-12/schema",
  "$id": "urn:tycoon:content-manifest-schema:v2",
  "type": "object",
  "additionalProperties": false,
  "required": [
    "schemaId",
    "contractVersion",
    "contentVersion",
    "csvSchemaSetVersion",
    "packageKind",
    "baseContentVersion",
    "minimumGameVersion",
    "channel",
    "generatedAtUtc",
    "tables"
  ],
  "properties": {
    "schemaId": {
      "const": "urn:tycoon:content-manifest:v2"
    },
    "contractVersion": {
      "const": 2
    },
    "contentVersion": {
      "type": "string",
      "pattern": "^[0-9]+\\.[0-9]+\\.[0-9]+-content\\.[1-9][0-9]*$"
    },
    "csvSchemaSetVersion": {
      "const": 3
    },
    "packageKind": {
      "enum": [
        "BASE",
        "PATCH",
        "TEMPLATE"
      ]
    },
    "baseContentVersion": {
      "type": [
        "string",
        "null"
      ]
    },
    "minimumGameVersion": {
      "type": "string",
      "pattern": "^(0|[1-9][0-9]*)\\.(0|[1-9][0-9]*)\\.(0|[1-9][0-9]*)(?:-[0-9A-Za-z.-]+)?$"
    },
    "channel": {
      "enum": [
        "DEV",
        "STAGING",
        "PRODUCTION"
      ]
    },
    "generatedAtUtc": {
      "type": "string",
      "pattern": "^\\d{4}-\\d{2}-\\d{2}T\\d{2}:\\d{2}:\\d{2}\\.\\d{3}Z$"
    },
    "tables": {
      "type": "array",
      "minItems": 1,
      "items": {
        "$ref": "#/$defs/table"
      }
    }
  },
  "allOf": [
    {
      "if": {
        "properties": {
          "packageKind": {
            "const": "BASE"
          }
        }
      },
      "then": {
        "properties": {
          "baseContentVersion": {
            "type": "null"
          }
        }
      }
    },
    {
      "if": {
        "properties": {
          "packageKind": {
            "enum": [
              "PATCH",
              "TEMPLATE"
            ]
          }
        }
      },
      "then": {
        "properties": {
          "baseContentVersion": {
            "type": "string"
          }
        }
      }
    }
  ],
  "$defs": {
    "field": {
      "type": "object",
      "additionalProperties": false,
      "required": [
        "name",
        "domain",
        "nullable",
        "enumValues"
      ],
      "properties": {
        "name": {
          "type": "string",
          "pattern": "^[a-z][a-z0-9_]*$"
        },
        "domain": {
          "enum": [
            "STRING",
            "STABLE_ID",
            "BOOL",
            "INT32",
            "INT64",
            "SAFE_INT",
            "DECIMAL",
            "UTC_INSTANT",
            "DATE",
            "LOCALE",
            "SEMVER",
            "HEX64",
            "SEED64",
            "STATUS",
            "ENUM"
          ]
        },
        "nullable": {
          "type": "boolean"
        },
        "enumValues": {
          "type": "array",
          "items": {
            "type": "string"
          },
          "uniqueItems": true
        }
      }
    },
    "foreignKey": {
      "type": "object",
      "additionalProperties": false,
      "required": [
        "sourceFields",
        "targetFile",
        "targetFields",
        "mode"
      ],
      "properties": {
        "sourceFields": {
          "type": "array",
          "minItems": 1,
          "items": {
            "type": "string"
          }
        },
        "targetFile": {
          "type": "string",
          "pattern": "^[a-z][a-z0-9_]*\\.csv$"
        },
        "targetFields": {
          "type": "array",
          "minItems": 1,
          "items": {
            "type": "string"
          }
        },
        "mode": {
          "enum": [
            "HARD",
            "SOFT"
          ]
        }
      }
    },
    "table": {
      "type": "object",
      "additionalProperties": false,
      "required": [
        "file",
        "schemaVersion",
        "required",
        "sha256",
        "rowCount",
        "primaryKey",
        "fields",
        "foreignKeys"
      ],
      "properties": {
        "file": {
          "type": "string",
          "pattern": "^[a-z][a-z0-9_]*\\.csv$"
        },
        "schemaVersion": {
          "type": "integer",
          "minimum": 1
        },
        "required": {
          "const": true
        },
        "sha256": {
          "type": "string",
          "pattern": "^[0-9a-f]{64}$"
        },
        "rowCount": {
          "type": "integer",
          "minimum": 0,
          "maximum": 9007199254740991
        },
        "primaryKey": {
          "type": "array",
          "minItems": 1,
          "items": {
            "type": "string"
          }
        },
        "fields": {
          "type": "array",
          "minItems": 1,
          "items": {
            "$ref": "#/$defs/field"
          }
        },
        "foreignKeys": {
          "type": "array",
          "items": {
            "$ref": "#/$defs/foreignKey"
          }
        }
      }
    }
  }
}
