{"baseContentVersion":null,"channel":"DEV","contentVersion":"1.0.0-content.2","contractVersion":2,"csvSchemaSetVersion":3,"generatedAtUtc":"2026-07-19T00:00:00.000Z","minimumGameVersion":"1.0.0-p04","packageKind":"BASE","schemaId":"urn:tycoon:content-manifest:v2","tables":[{"fields":[{"domain":"STABLE_ID","enumValues":[],"name":"asset_id","nullable":false},{"domain":"STRING","enumValues":[],"name":"name","nullable":false},{"domain":"STRING","enumValues":[],"name":"creator","nullable":true},{"domain":"STRING","enumValues":[],"name":"source_url","nullable":true},{"domain":"STRING","enumValues":[],"name":"version","nullable":true},{"domain":"DATE","enumValues":[],"name":"acquired_date","nullable":true},{"domain":"SAFE_INT","enumValues":[],"name":"price_krw","nullable":false},{"domain":"STRING","enumValues":[],"name":"license","nullable":true},{"domain":"BOOL","enumValues":[],"name":"commercial_use","nullable":true},{"domain":"BOOL","enumValues":[],"name":"modification_allowed","nullable":true},{"domain":"BOOL","enumValues":[],"name":"credit_required","nullable":true},{"domain":"STRING","enumValues":[],"name":"used_in","nullable":true},{"domain":"STRING","enumValues":[],"name":"notes","nullable":true},{"domain":"STATUS","enumValues":[],"name":"status","nullable":false},{"domain":"BOOL","enumValues":[],"name":"enabled","nullable":false}],"file":"asset_register.csv","foreignKeys":[],"primaryKey":["asset_id"],"required":true,"rowCount":18,"schemaVersion":1,"sha256":"f44f551c6929a08cbb781e71cbadc24f37dbcc721725843b3729498e4c6fd149"},{"fields":[{"domain":"ENUM","enumValues":["IDLE_TOWN","PREPARE","TRAVEL_TO_REGION","FIND_TARGET","COMBAT","LOOT","CONTINUE_DECISION","RETURN_TOWN","SELL_LOOT","HEAL","BUY_CONSUMABLES","EVALUATE_EQUIPMENT","BUY_EQUIPMENT","PROMOTION_READY","PROMOTION_PROCESS","INJURED","RAID_READY"],"name":"state","nullable":false},{"domain":"INT32","enumValues":[],"name":"rule_no","nullable":false},{"domain":"INT32","enumValues":[],"name":"priority","nullable":false},{"domain":"STABLE_ID","enumValues":[],"name":"condition_type","nullable":false},{"domain":"DECIMAL","enumValues":[],"name":"condition_value","nullable":true},{"domain":"ENUM","enumValues":["NONE","POLICY","HP_LOW","POTION_LOW","INVENTORY_FULL","SURVIVAL_LOW","PLAYER_RECALL","TARGET_FOUND","LOOT_COMPLETE","PROMOTION_AVAILABLE"],"name":"reason_code","nullable":false},{"domain":"ENUM","enumValues":["IDLE_TOWN","PREPARE","TRAVEL_TO_REGION","FIND_TARGET","COMBAT","LOOT","CONTINUE_DECISION","RETURN_TOWN","SELL_LOOT","HEAL","BUY_CONSUMABLES","EVALUATE_EQUIPMENT","BUY_EQUIPMENT","PROMOTION_READY","PROMOTION_PROCESS","INJURED","RAID_READY"],"name":"next_state","nullable":false},{"domain":"STATUS","enumValues":[],"name":"status","nullable":false},{"domain":"BOOL","enumValues":[],"name":"enabled","nullable":false}],"file":"autonomy_rules.csv","foreignKeys":[],"primaryKey":["state","rule_no"],"required":true,"rowCount":37,"schemaVersion":1,"sha256":"a2b63279625d436e18011da606471724a00b4700bed6b3489e57bfbc68c4272f"},{"fields":[{"domain":"STABLE_ID","enumValues":[],"name":"condition_group_id","nullable":false},{"domain":"INT32","enumValues":[],"name":"member_no","nullable":false},{"domain":"ENUM","enumValues":["CONDITION","GROUP"],"name":"member_type","nullable":false},{"domain":"STABLE_ID","enumValues":[],"name":"condition_id","nullable":true},{"domain":"STABLE_ID","enumValues":[],"name":"child_group_id","nullable":true},{"domain":"BOOL","enumValues":[],"name":"negate","nullable":false},{"domain":"STATUS","enumValues":[],"name":"status","nullable":false},{"domain":"BOOL","enumValues":[],"name":"enabled","nullable":false}],"file":"condition_group_members.csv","foreignKeys":[{"mode":"HARD","sourceFields":["condition_group_id"],"targetFields":["condition_group_id"],"targetFile":"condition_groups.csv"},{"mode":"HARD","sourceFields":["condition_id"],"targetFields":["condition_id"],"targetFile":"conditions.csv"},{"mode":"HARD","sourceFields":["child_group_id"],"targetFields":["condition_group_id"],"targetFile":"condition_groups.csv"}],"primaryKey":["condition_group_id","member_no"],"required":true,"rowCount":38,"schemaVersion":1,"sha256":"d07c0ab53279eaf11806cd8e90b3a6415ef704f6e197628205dc77e3df74f2ba"},{"fields":[{"domain":"STABLE_ID","enumValues":[],"name":"condition_group_id","nullable":false},{"domain":"ENUM","enumValues":["ALL","ANY"],"name":"logic","nullable":false},{"domain":"STABLE_ID","enumValues":[],"name":"description_key","nullable":true},{"domain":"STATUS","enumValues":[],"name":"status","nullable":false},{"domain":"BOOL","enumValues":[],"name":"enabled","nullable":false}],"file":"condition_groups.csv","foreignKeys":[],"primaryKey":["condition_group_id"],"required":true,"rowCount":21,"schemaVersion":1,"sha256":"e3b888ec7dc13f63b388a5bcbebcfe0f4f953d97136843f19d5138526ab88dff"},{"fields":[{"domain":"STABLE_ID","enumValues":[],"name":"condition_id","nullable":false},{"domain":"ENUM","enumValues":["ALWAYS_TRUE","FACILITY_UPGRADE_COUNT","FACILITY_LEVEL","REGION_UNLOCKED","REGION_PROGRESS_PERCENT","MONSTER_KILL_COUNT","MERCENARY_COUNT_AT_RANK_OR_HIGHER","RAID_CLEAR_COUNT","KINGDOM_STAGE_REACHED","RAID_PART_BROKEN","RAID_PART_EXPOSED","TUTORIAL_STEP_COMPLETED"],"name":"condition_type","nullable":false},{"domain":"ENUM","enumValues":["SYSTEM","KINGDOM","FACILITY","REGION","MONSTER","MERCENARY_ROSTER","RAID","KINGDOM_STAGE","RAID_PART","TUTORIAL_STEP"],"name":"subject_type","nullable":false},{"domain":"STABLE_ID","enumValues":[],"name":"subject_id","nullable":true},{"domain":"STABLE_ID","enumValues":[],"name":"subject_sub_id","nullable":true},{"domain":"ENUM","enumValues":["EQ","NE","GTE","LTE","GT","LT"],"name":"operator","nullable":false},{"domain":"ENUM","enumValues":["BOOLEAN","INTEGER","DECIMAL","STABLE_ID"],"name":"value_type","nullable":false},{"domain":"STRING","enumValues":[],"name":"expected_value","nullable":false},{"domain":"STATUS","enumValues":[],"name":"status","nullable":false},{"domain":"BOOL","enumValues":[],"name":"enabled","nullable":false}],"file":"conditions.csv","foreignKeys":[],"primaryKey":["condition_id"],"required":true,"rowCount":34,"schemaVersion":1,"sha256":"a94dac2c8f5dd2c0da3427d5c1b0e978a48532cda8e7729ead442e92cc6a0fbf"},{"fields":[{"domain":"ENUM","enumValues":["JOB","SKILL","TRAIT","PERSONALITY","MERCENARY_GRADE","MERCENARY_RANK","MERCENARY_GENERATION_PROFILE","ITEM","POTION","EQUIPMENT_TEMPLATE","EQUIPMENT_QUALITY","REFINE_OPTION","FACILITY","NPC_PROFESSION","NPC_PROFICIENCY","KINGDOM_STAGE","REGION","MONSTER","RAID","RAID_PART","RECIPE","REWARD_GROUP","TUTORIAL_STEP","STATUS_EFFECT","RECRUITMENT_POOL","PITY_GROUP","PITY_RULE","RATE_UP_GROUP","CONDITION_GROUP","PROGRESSION_FLAG","RUNTIME_CONFIG"],"name":"entity_type","nullable":false},{"domain":"STABLE_ID","enumValues":[],"name":"from_id","nullable":false},{"domain":"STRING","enumValues":[],"name":"from_content_version","nullable":false},{"domain":"ENUM","enumValues":["RENAME","MERGE","TOMBSTONE"],"name":"alias_type","nullable":false},{"domain":"STABLE_ID","enumValues":[],"name":"to_id","nullable":true},{"domain":"STATUS","enumValues":[],"name":"status","nullable":false},{"domain":"BOOL","enumValues":[],"name":"enabled","nullable":false}],"file":"content_aliases.csv","foreignKeys":[],"primaryKey":["entity_type","from_id","from_content_version"],"required":true,"rowCount":0,"schemaVersion":1,"sha256":"a398fb76d2c1b0698e90bb0e5369d330b013a75f3d568c96a8c4a81e9b24986a"},{"fields":[{"domain":"STABLE_ID","enumValues":[],"name":"currency_id","nullable":false},{"domain":"ENUM","enumValues":["KINGDOM","PREMIUM_FREE","PREMIUM_PAID","TICKET"],"name":"currency_type","nullable":false},{"domain":"ENUM","enumValues":["LOCAL","SERVER"],"name":"authority","nullable":false},{"domain":"SAFE_INT","enumValues":[],"name":"max_balance","nullable":false},{"domain":"STABLE_ID","enumValues":[],"name":"name_text_key","nullable":false},{"domain":"STATUS","enumValues":[],"name":"status","nullable":false},{"domain":"BOOL","enumValues":[],"name":"enabled","nullable":false}],"file":"currencies.csv","foreignKeys":[{"mode":"HARD","sourceFields":["name_text_key"],"targetFields":["text_key"],"targetFile":"localizations.csv"}],"primaryKey":["currency_id"],"required":true,"rowCount":4,"schemaVersion":1,"sha256":"a2214c4c527aa654dab12449f3e528e9e1b44ea1048b8f9851b13d8cdd53120b"},{"fields":[{"domain":"INT32","enumValues":[],"name":"target_level","nullable":false},{"domain":"DECIMAL","enumValues":[],"name":"success_chance","nullable":false},{"domain":"STABLE_ID","enumValues":[],"name":"stone_item_id","nullable":false},{"domain":"SAFE_INT","enumValues":[],"name":"stone_quantity","nullable":false},{"domain":"SAFE_INT","enumValues":[],"name":"personal_gold_cost","nullable":false},{"domain":"DECIMAL","enumValues":[],"name":"fail_pity_increment","nullable":false},{"domain":"BOOL","enumValues":[],"name":"destroy_on_fail","nullable":false},{"domain":"BOOL","enumValues":[],"name":"downrank_on_fail","nullable":false},{"domain":"STATUS","enumValues":[],"name":"status","nullable":false},{"domain":"BOOL","enumValues":[],"name":"enabled","nullable":false}],"file":"enhancement_rules.csv","foreignKeys":[{"mode":"HARD","sourceFields":["stone_item_id"],"targetFields":["item_id"],"targetFile":"items.csv"}],"primaryKey":["target_level"],"required":true,"rowCount":10,"schemaVersion":1,"sha256":"2c9edde3c79aa4588e749f6718f812638b45b7b6f674eddcb937011bc72866ac"},{"fields":[{"domain":"STABLE_ID","enumValues":[],"name":"equipment_template_id","nullable":false},{"domain":"STABLE_ID","enumValues":[],"name":"job_id","nullable":false},{"domain":"STATUS","enumValues":[],"name":"status","nullable":false},{"domain":"BOOL","enumValues":[],"name":"enabled","nullable":false}],"file":"equipment_job_eligibility.csv","foreignKeys":[{"mode":"HARD","sourceFields":["equipment_template_id"],"targetFields":["equipment_template_id"],"targetFile":"equipment_templates.csv"},{"mode":"HARD","sourceFields":["job_id"],"targetFields":["job_id"],"targetFile":"